{
  "$schema": "../../../../schemas/aether-kinetic-calculation-register.schema.json",
  "schemaVersion": "1.0.0",
  "fixtureId": "vx4800-bf-01",
  "registerRevision": "1.0.0",
  "status": "engineering-calculation-input-not-released",
  "authority": "engineering-development-input",
  "finalCalculationPackageReleased": false,
  "controlledBaseline": {
    "elementCount": 240,
    "sizeAllocation": {"S": 66, "M": 144, "L": 30},
    "canopyEnvelopeMm": [2400, 1500, 150],
    "rotatingCarrierCoordinationMm": {"width": 2260, "depth": 1330, "thicknessParameter": 24},
    "speedRpm": {"minimum": 0.08, "nominal": 0.36, "maximum": 0.65},
    "fixedAccentHeadCount": 14,
    "slipRingStatus": "not-required-by-current-architecture"
  },
  "evidenceClasses": [
    "published-manufacturer-data",
    "engineering-calculation",
    "prototype-measurement",
    "controlled-production-measurement",
    "assumption",
    "design-target"
  ],
  "calculationRules": [
    "Catalog maximum ratings are not VX4800 design loads and cannot be copied into product calculations as applied loads.",
    "Rigid-body polar inertia from the rotating mass map is a screening and drive-input quantity only; suspended elements can lag during acceleration and braking and require T1/T2/T3/T4 physical correlation.",
    "Every numeric input must carry an evidence class and source; assumptions remain visibly labelled and cannot silently become controlled production values.",
    "Drive sizing must include acceleration demand plus bearing resistance, transmission losses, drag, imbalance and other approved resistances rather than inertia alone.",
    "Bearing/support calculations must include drive pretension/tangential reactions, brake reactions and structural mounting stiffness where applicable.",
    "Fault-stop and retention cases must use approved failure scenarios from the released risk assessment rather than arbitrary emergency factors.",
    "A load case may become verified only after its calculation is independently checked and its physical-correlation requirement, where applicable, is satisfied."
  ],
  "loadCases": [
    {
      "id": "KLC-001",
      "name": "static gravity and combined bearing load",
      "status": "blocked-inputs",
      "purpose": "Establish primary static gravity, radial eccentricity and overturning-moment inputs for bearing/support selection and structural reactions.",
      "requiredInputs": ["controlled full rotating mass map including carrier/drive rotating parts", "controlled rotating center of gravity", "site orientation/gravity case", "selected bearing/support geometry", "drive pretension reactions where present"],
      "sourceEvidence": [
        {"class": "controlled-production-measurement", "source": "Issue #9 production S/M/L mass records plus controlled rotating-component mass records", "status": "required"},
        {"class": "engineering-calculation", "source": "approved mass-map and CG calculation", "status": "required"},
        {"class": "published-manufacturer-data", "source": "exact selected bearing mounting/load method", "status": "required"}
      ],
      "outputs": [
        {"id": "bearingAxialLoad", "value": null, "unit": "N", "status": "tbd"},
        {"id": "bearingRadialLoad", "value": null, "unit": "N", "status": "tbd"},
        {"id": "bearingOverturningMoment", "value": null, "unit": "N*m", "status": "tbd"},
        {"id": "fixedSupportReactions", "value": null, "unit": null, "status": "tbd"}
      ],
      "prohibitedAssumptions": ["do not infer total mass from visual material choice", "do not assume CG is exactly on the rotation axis", "do not omit drive pretension from support reactions"],
      "verificationMethod": ["independent calculation check", "prototype mass/CG reconciliation", "supplier combined-load review for exact bearing variant"]
    },
    {
      "id": "KLC-002",
      "name": "jerk-limited start transient",
      "status": "blocked-inputs",
      "purpose": "Determine propulsion and support demand during the released start profile while accounting for suspended-field lag rather than treating the field as rigidly attached.",
      "requiredInputs": ["controlled mass map and screening polar inertia", "candidate acceleration/jerk profile", "measured T1/T2 suspended-element lag and damping", "bearing running resistance", "transmission efficiency/compliance", "air-drag evidence"],
      "sourceEvidence": [
        {"class": "engineering-calculation", "source": "mass-map rigid-body inertia screening", "status": "required"},
        {"class": "prototype-measurement", "source": "T1/T2 jerk/start response and drive-load correlation", "status": "required"},
        {"class": "published-manufacturer-data", "source": "selected bearing and transmission data", "status": "required"}
      ],
      "outputs": [
        {"id": "startTorqueEnvelope", "value": null, "unit": "N*m", "status": "tbd"},
        {"id": "startSupportReactionEnvelope", "value": null, "unit": null, "status": "tbd"},
        {"id": "approvedStartAcceleration", "value": null, "unit": "rad/s^2", "status": "tbd"},
        {"id": "approvedStartJerk", "value": null, "unit": "rad/s^3", "status": "tbd"}
      ],
      "prohibitedAssumptions": ["do not use rigid-body inertia as the complete suspended-field transient model", "do not invent acceleration or jerk from aesthetic animation timing", "do not infer final drive torque from test-rig motor rating"],
      "verificationMethod": ["T1/T2 physical correlation", "later T3/T4 full-mechanism correlation", "independent drive-sizing check"]
    },
    {
      "id": "KLC-003",
      "name": "steady nominal operation",
      "status": "blocked-inputs",
      "purpose": "Establish nominal continuous drive load, thermal duty, bearing resistance and field offset at 0.36 rpm.",
      "requiredInputs": ["selected bearing running torque under actual load/preload", "selected transmission losses", "measured airflow/drag sensitivity", "measured steady field lag/offset", "balance state"],
      "sourceEvidence": [
        {"class": "published-manufacturer-data", "source": "exact selected bearing and drive/reducer data", "status": "required"},
        {"class": "prototype-measurement", "source": "T1/T2 and later T4 steady-state measurements", "status": "required"}
      ],
      "outputs": [
        {"id": "nominalDriveTorque", "value": null, "unit": "N*m", "status": "tbd"},
        {"id": "nominalDrivePower", "value": null, "unit": "W", "status": "tbd"},
        {"id": "nominalFieldOffset", "value": null, "unit": "deg", "status": "tbd"},
        {"id": "nominalThermalState", "value": null, "unit": null, "status": "tbd"}
      ],
      "prohibitedAssumptions": ["do not equate low rpm with negligible friction or thermal duty", "do not assume zero aerodynamic offset"],
      "verificationMethod": ["instrumented continuous operation", "temperature stabilization measurement", "command-versus-actual drive-load comparison"]
    },
    {
      "id": "KLC-004",
      "name": "maximum approved speed operation",
      "status": "blocked-inputs",
      "purpose": "Establish continuous and dynamic effects at the controlled maximum speed of 0.65 rpm without assuming nominal-speed behaviour scales trivially.",
      "requiredInputs": ["controlled mass map", "measured field dynamics at maximum approved speed", "bearing running torque", "drag/airflow evidence", "transmission and reducer thermal data", "dynamic clearance evidence"],
      "sourceEvidence": [
        {"class": "design-target", "source": "controlled product maximum speed 0.65 rpm", "status": "controlled"},
        {"class": "prototype-measurement", "source": "staged T1-T4 maximum-speed testing", "status": "required"},
        {"class": "published-manufacturer-data", "source": "selected drive/bearing continuous-duty data", "status": "required"}
      ],
      "outputs": [
        {"id": "maxSpeedDriveLoad", "value": null, "unit": "N*m", "status": "tbd"},
        {"id": "maxSpeedFieldLag", "value": null, "unit": "deg", "status": "tbd"},
        {"id": "maxSpeedMinimumDynamicClearances", "value": null, "unit": null, "status": "tbd"}
      ],
      "prohibitedAssumptions": ["do not linearly scale all nominal results to maximum speed", "do not approve dynamic clearances from static/BVH screening alone"],
      "verificationMethod": ["staged physical maximum-speed tests", "full-field T4 clearance and thermal verification"]
    },
    {
      "id": "KLC-005",
      "name": "controlled normal stop",
      "status": "blocked-inputs",
      "purpose": "Determine normal deceleration, stop travel, field excitation and settling requirements using the healthy drive and released motion profile.",
      "requiredInputs": ["controlled mass/inertia screening", "candidate deceleration/jerk profile", "measured suspended-field stop response", "drive/bearing resistance", "required settling criterion"],
      "sourceEvidence": [
        {"class": "prototype-measurement", "source": "T1/T2 normal-stop response", "status": "required"},
        {"class": "engineering-calculation", "source": "drive/deceleration screening calculation", "status": "required"}
      ],
      "outputs": [
        {"id": "normalStopTorqueEnvelope", "value": null, "unit": "N*m", "status": "tbd"},
        {"id": "normalStopTime", "value": null, "unit": "s", "status": "tbd"},
        {"id": "normalStopAngularTravel", "value": null, "unit": "deg", "status": "tbd"},
        {"id": "restartSettlingCriterion", "value": null, "unit": null, "status": "tbd"}
      ],
      "prohibitedAssumptions": ["do not set stop time only from motor capability", "do not release restart before measured field settling is controlled"],
      "verificationMethod": ["T1/T2 stop/settling correlation", "T4 stop and restart validation"]
    },
    {
      "id": "KLC-006",
      "name": "power-loss and fault stop",
      "status": "blocked-inputs",